"Change is the constant, the signal for rebirth, the egg of the phoenix.",To weep is to make less the depth of grief.,"As long as one keeps searching, the answers come.",The greatest evil that can befall man is that he should come to think ill of himself.,An open ear is the only believable sign of an open heart.,"When I let go of what I am, I become what I might be.","Everyone has the fire, but the champions know when to ignite the spark.
Amit Ray","Whatever you can do or dream you can, begin it. Boldness has genius, power and magic in it.",Everything that irritates us about others can lead us to an understanding of ourselves.,"They say that time changes things, but you actually have to change them yourself.","Just remember, when you think all is lost, the future remains.",Abundance is not something we acquire. It is something we tune into.,"As soon as you trust yourself, you will know how to live.","You will never be who you want to be, until you are happy with who you are.",People do not decide to become extraordinary. They decide to accomplish extraordinary things.,The important thing is to learn a lesson every time you lose.,Don't play for safety. It's the most dangerous thing in the world.,It has been my philosophy of life that difficulties vanish when faced boldly.,It's better to look ahead and prepare than to look back and regret.,Never say anything about yourself you do not want to come true.,See the light in others and treat them as if that is all you see.,"We can do more good by being good, than in any other way.","It is our light, not our darkness that most frightens us.",Our deepest fear is not that we are inadequate. Our deepest fear is that we are powerful beyond measure.,I am who I am today because of the choices I made yesterday.,The love of one's country is a splendid thing. But why should love stop at the border?,Whatever we plant in our subconscious mind and nourish with repetition and emotion will one day become a reality.,Only those who will risk going too far can possibly find out how far one can go.,One can never consent to creep when one feels an impulse to soar.,The biggest adventure you can ever take is to live the life of your dreams.,"Difficulties strengthen the mind, as labor does the body.",Facts do not cease to exist because they are ignored.,You must do the thing you think you cannot do.,Being aware of your fear is smart. Overcoming it is the mark of a successful person.,Doing the best at this moment puts you in the baest place for the next moment.,"Whatever you think the world is withholding from you, you are withholding from the world.","When defeat comes, accept it as a signal that your plans are not sound, rebuild those plans, and set sail once more.","Lineage, personality, and environment may shape you, but they do not define your full potential.",Challenges are what make life interesting and overcoming them is what makes life meaningful.,"Fix your eyes forward on what you can do, not back on what you cannot change.",The measure of a man is what he does with power.,Your days are numbered. Use them to throw open the windows of your soul to the sun.,"Anxiety does not empty tomorrow of its sorrows, but only empties today of its strength.","Don't be afraid of your fears. They're not there to scare you. They're there to let you know that something is worth it.” 
― C. JoyBell C.","Nothing can dim the light which shines from within.
Maya Angelou","Is fear preventing you from taking action? Acknowledge the fear, watch it, take your attention into it, be fully present with it.  Doing so cuts the link between the fear and your thinking.","Authority without wisdom is like a heavy axe without an edge, fitter to bruise than polish.
Anne Bradstreet","If you're reading this...
Congratulations, you're alive.
If that's not something to smile about,
then I don't know what is.
Chad Sugg","It is the mark of an educated mind to be able to entertain a thought without accepting it.
Aristotle","The saddest aspect of life right now is that science gathers knowledge faster than society gathers wisdom.
Isaac Asimov","Share our similarities, celebrate our differences.
M. Scott Peck","No wise man ever wished to be younger.
Jonathan Swift","The best doctors in the world are Dr Diet, Dr Quiet and Dr Merryman.","What a liberation to realise that the “voice in my head” is not who I am.
Eckhart Tolle","The curious paradox is that when I accept myself just as I am, then I can change.
Carl R. Rogers","Strong people don't put others down... They lift them up.
Michael P. Watson",No one has ever become poor by giving.,Educating the mind without educating the heart is no education at all.,No wise man ever wished to be younger.,Scared is what you're feeling. Brave is what you're doing.,The reverse side also has a reverse side.,Only bad writers think that their work is really good.,The past beats inside me like a second heart.,We are not human beings having a spiritual experience we are spiritual beings having a human experience.,Gratitude is heaven itself,Vision without action is a daydream. Action without vision is a nightmare.,Fall down seven times. Stand up eight. Japanese Proverb,We need silence to be able to touch souls.,All those who are unhappy in the world are so as a result of their desire for the own unhappiness.,Everybody's damaged by something.,If we could see the miracle of a single flower clearly our whole life would change.,Always do what you are afraid to do.,This world is but a canvas to our imagination.,Smooth seas do not make skilful sailors.,Dont walk in front of me… I may not follow. Dont walk behind me… I may not lead. Walk beside me… just be my friend.  Albert Camus,Beware what you set your heart upon. For it surely shall be yours.,True charity is the desire to be useful to others with no thought of recompense.,You ought to expect better of people. It encourages you to be a better person yourself.,Life begins at the end of your comfort zone.,A jewel will not shine if it is not polished.,Be as simple as you can be you will be astonished to see how uncomplicated and happy your life can become.,For every action there is an equal and opposite reaction. You receive from the world what you give to the world.,Its important to be comfortable with uncertainty.,A single conversation with a wise man is better than ten years of study.,Time flows in the same way for all human beings every human being flows through time in a different way.,You talk when you cease to be at peace with your thoughts.,Darkness cannot drive out darkness only light can do that. Hate cannot drive out hate only love can do that.,The price of inaction is far greater than the cost of making a mistake.,Intuition is seeing with the soul.,“Maintaining order rather than correcting disorder is the ultimate principal of wisdom. To cure disease after it has appeared is like digging a well when one feels thirsty or forging weapons after the war has already begun”.  Huangdi Neijing,Wanting to be someone else is a waste of the person you are.,Peace comes from within. Do not seek it without.,Knowledge is proud that he has learned so much. Wisdom is humble that he knows not more.,The history of free men is never really written by chance but by choice their choice!,Life without liberty is like a body without spirit.,Each of us has a unique part to play in the healing of the world.,"In the face of impossible odds, people who love this country can change it.","The ultimate measure of a man is not where he stands in moments of comfort and convenience, but where he stands at times of challenge and controversy.",Observe good faith and justice toward all nations. Cultivate peace and harmony with all.,"Ask not what your country can do for you ask what you can do for your country.
John F. Kennedy","I'd like to be remembered as a person who wanted to be free and wanted other people to be also free. 
